<?xml version="1.0"?>
<class xmlns="http://www.w3.org/2001/XMLSchema"  xmlns:xsi="http://www.w3.org/2001/XMLSchema-instance"
 xsi:schemaLocation="http://www.w3.org/2001/XMLSchema class.xsd" id="C1" classroom="1班">
	<student addr="杭州" studentID="n1" sex="男" classID="C1" lesson="面授"  friend="n2">
		<name>张三</name>
		<age>20</age>
		<comment>12342</comment>
	</student>
	<student addr="上海" studentID="n2" sex="女" classID="C1" lesson="面授"  friend="n1">
		<name>王菲</name>
		<age>20</age>
		<comment>4333</comment>
	</student>
	<teacher age="30" sex="男">琴酒</teacher>
</class>